<?xml version="1.0" encoding="utf-8"?>
<!-- edited with XMLSpy v2005 rel. 3 U (http://www.altova.com) by  () -->
<?mso-infoPathSolution PIVersion="1.0.0.0" name="urn:courses:statmod-ru" language="ru" solutionVersion="1.0.0.27" productVersion="14.0.0" ?>
<?mso-application progid="InfoPath.Document"?>
<courses xmlns:xsi="http://www.w3.org/2001/XMLSchema-instance" xmlns="http://statmod.ru/courses" year="2012/2013" spec="sa" xsi:schemaLocation="http://statmod.ru/courses spec.xsd">
	<course semester="5" year="3" class="общ." extras="" hours="2" exam="зачет" year_equiv="0.5" alias="all_teorver_pract">
		<name xml:lang="ru">Теория вероятностей</name>
		<prof id="vv_nekrutkin"/>
	</course>
	<course semester="5" year="3" class="общ." extras="" hours="2" exam="зачет" year_equiv="0.5" alias="sa_prog_c_pract">
		<name xml:lang="ru">Выч. практика</name>
		<prof id="vb_christinich"/>
	</course>
	<course semester="5" year="3" class="с/к" extras="СД1" hours="2" exam="экз." year_equiv="0.5" alias="sa_graph_theory">
		<name xml:lang="ru">Структурное представление систем</name>
		<prof id="ya_sushkov"/>
	</course>
	<course semester="5" year="3" class="с/с" extras="СС1" hours="2" exam="зачет" year_equiv="0.5" alias="sa_prog_c_lang">
		<name xml:lang="ru">Алгоритмические языки</name>
		<prof id="vb_christinich"/>
	</course>
	<course semester="6" year="3" class="общ." extras="" hours="2" exam="доп." year_equiv="0.5" alias="all_teorver_pract">
		<name xml:lang="ru">Теория вероятностей</name>
		<prof id="vv_nekrutkin"/>
	</course>
	<course semester="6" year="3" class="общ." extras="" exam="доп." year_equiv="" alias="all_teorver_kurs">
		<name xml:lang="ru">Курсовая работа по теор. вер.</name>
		<prof id="vv_nekrutkin"/>
		<!--<co:questions xmlns:co="http://statmod.ru/courses" file="3_sm_sa_2009.pdf">
	<co:file_name>2008/2009</co:file_name>	</co:questions>
    	-->
	</course>
	<course semester="6" year="3" class="общ." extras="" hours="4" exam="зачет" year_equiv="1" alias="sa_prog_cpp">
		<name xml:lang="ru">Спец. выч. практикум</name>
		<prof id="vb_christinich"/>
	</course>
	<course semester="6" year="3" class="с/к" extras="СД2" hours="2" exam="" year_equiv="" alias="sa_montecarlo">
		<name xml:lang="ru">Численные методы Монте-Карло</name>
		<prof id="tm_tovstik"/>
	</course>
	<course semester="6" year="3" class="с/с" extras="СС2" hours="2" exam="зачет" year_equiv="0.5" alias="sa_statmod">
		<name xml:lang="ru">Численное моделирование</name>
		<prof id="tm_tovstik"/>
	</course>
	<course semester="7" year="4" class="общ." extras="" hours="3" exam="экз." year_equiv="0.5" alias="all_stat">
		<name xml:lang="ru">Мат. модел. и обработка данных</name>
		<part type="lect" hours="2">
			<prof id="ms_ermakov"/>
		</part>
		<part type="pract" hours="1">
			<prof id="ai_korobeynikov"/>
		</part>
	</course>
	<course semester="7" year="4" class="общ." extras="" hours="2" exam="зачет" year_equiv="0.5" alias="sa_prog_cpp_advanced">
		<name xml:lang="ru">Спец. выч. практикум</name>
		<prof id="yn_kashtanov"/>
	</course>
	<course semester="7" year="4" class="общ." extras="ф." hours="2" exam="зачет" year_equiv="0.5" alias="sa_prog_threads">
		<name xml:lang="ru">Практикум по совр. прикл. программированию</name>
		<prof id="yn_kashtanov"/>
	</course>
	<course semester="7" year="4" class="общ." extras="выб." hours="2" exam="зачет" year_equiv="0.5" alias="all_communication">
		<name xml:lang="ru">Современные средства и методы научной коммуникации в области статистического моделирования</name>
	<prof id="ai_korobeynikov"/>
	</course>
<course semester="7" year="4" class="ОПД" extras="выб." hours="2" exam="зачет" year_equiv="0.5" alias="all_finmodel">
		<name xml:lang="ru">Задачи фин. мат. и стат. мод-ия</name>
		<prof id="yn_kashtanov"/>
	</course>
	<course semester="7" year="4" class="с/к" extras="СД2" hours="2" exam="экз." year_equiv="1" alias="sa_montecarlo">
		<name xml:lang="ru">Численные методы Монте-Карло</name>
		<prof id="tm_tovstik"/>
	<co:questions xmlns:co="http://statmod.ru/courses" file="4_7__sa_montecarlo.pdf">
									<co:file_name>2011/2012</co:file_name>
								</co:questions></course>
	<course semester="7" year="4" class="с/к" extras="СД3" hours="2" exam="" year_equiv="" alias="sa_system_model">
		<name xml:lang="ru">Моделирование систем</name>
		<prof id="ya_sushkov"/>
	</course>
	<course semester="7" year="4" class="с/с" extras="СС3" hours="2" exam="зачет" year_equiv="0.5" alias="sa_appl_stat">
		<name xml:lang="ru">Численные методы статистики</name>
		<prof id="ne_golyandina"/>
	</course>
	<course semester="8" year="4" class="общ." extras="" hours="2" exam="экз." year_equiv="0.5" alias="all_statmod">
		<name xml:lang="ru">Мат. модел. и обработка данных</name>
		<prof id="sm_ermakov"/>
	</course>
	<course semester="8" year="4" class="общ." extras="ф." hours="2" exam="зачет" year_equiv="0.5" alias="sa_montecarlo_pract">
		<name xml:lang="ru">Практикум по совр. прикл. программированию</name>
		<prof id="pv_shpilev"/>
	</course>
	<course semester="8" year="4" class="общ." extras="выб." hours="2" exam="зачет" year_equiv="0.5" alias="all_finance_insurance">
		<name xml:lang="ru">Элементы фин. математики</name>
		<prof id="tm_tovstik"/>
	</course>
	<course semester="8" year="4" class="ОПД" extras="выб." hours="5" exam="экз." year_equiv="0.75" alias="all_prog_matlab">
		<name xml:lang="ru">Выч. методы и пакеты в стат.исследованиях</name>
		<part type="lect" hours="3">
			<prof id="ai_korobeynikov"/>
		</part>
		<part type="pract" hours="2">
			<prof id="ai_korobeynikov"/>
		</part>
	</course>
	<course semester="8" year="4" class="с/к" extras="СД3" hours="2" exam="экз." year_equiv="1" alias="sa_system_model">
		<name xml:lang="ru">Моделирование систем</name>
		<prof id="ya_sushkov"/>
	</course>
	<course semester="8" year="4" class="с/к" extras="СД4 (1)" hours="2" exam="экз." year_equiv="0.5(1)" alias="sa_stat_pract">
		<name xml:lang="ru">Анализ данных и стох. выч. методы (Анализ данных и стат. пакеты)</name>
		<prof id="ne_golyandina"/>
	<co:questions xmlns:co="http://statmod.ru/courses" file="4_8__sa_stat_pract.pdf">
									<co:file_name>2010/2011</co:file_name>
								</co:questions></course>
	<course semester="8" year="4" class="с/к" extras="СД4 (2)" hours="2" exam="экз." year_equiv="0.5(1)" alias="sa_parallel_comp">
		<name xml:lang="ru">Анализ данных и стох. выч. методы (Введение в парал. вычисления)</name>
		<prof id="sm_ermakov"/>
		<co:questions xmlns:co="http://statmod.ru/courses" file="4_8__sa_parallel_comp.pdf">
			<co:file_name>2011/2012</co:file_name>
		</co:questions>
	</course>
	<course semester="8" year="4" class="с/с" extras="СС4" hours="2" exam="зачет" year_equiv="0.5" alias="sa_system_model_pract">
		<name xml:lang="ru">Моделирование систем</name>
		<prof id="ya_sushkov"/>
	</course>
	<course semester="9" year="5" class="с/к" extras="СД5" hours="4" exam="экз." year_equiv="1" alias="sa_automaton_model">
		<name xml:lang="ru">Автоматное моделирование</name>
		<prof id="en_mosyagina"/>
		<co:questions xmlns:co="http://statmod.ru/courses" file="5_99_sa_automaton_model.pdf">
			<co:file_name>2011/2012</co:file_name>
		</co:questions>
	</course>
	<course semester="9" year="5" class="с/к" extras="СД6 (1)" hours="2" exam="экз." year_equiv="0.5(1)" alias="sa_simul_stoch_proc">
		<name xml:lang="ru">Моделирование случайных процессов и принятие решений (Моделирование случайных процессов)</name>
		<prof id="tm_tovstik"/>
	<co:questions xmlns:co="http://statmod.ru/courses" file="5_9__sa_simul_stoch_proc.pdf">
									<co:file_name>2011/2012</co:file_name>
								</co:questions></course>
	<course semester="9" year="5" class="с/к" extras="СД6 (2)" hours="2" exam="экз." year_equiv="0.5(1)" alias="sa_decision_make">
		<name xml:lang="ru">Моделирование случайных процессов и принятие решений (Принятие решений)</name>
		<prof id="ya_sushkov"/>
	</course>
	<course semester="9" year="5" class="с/с" extras="СС5" hours="2" exam="зачет" year_equiv="0.5" alias="sa_simul_stoch_proc_pract">
		<name xml:lang="ru">Моделирование случайных процессов</name>
		<prof id="tm_tovstik"/>
	</course>
	<course semester="10" year="5" class="с/с" extras="СС6" hours="2" exam="зачет" year_equiv="0.5" alias="sa_decision_make_pract">
		<name xml:lang="ru">Принятие решений</name>
		<prof id="ya_sushkov"/>
	</course>
</courses>
