<?xml version="1.0" encoding="utf-8"?>
<?mso-infoPathSolution PIVersion="1.0.0.0" name="urn:courses:statmod-ru" language="ru" solutionVersion="1.0.0.27" productVersion="14.0.0" ?>
<?mso-application progid="InfoPath.Document"?>
<courses xmlns:xsi="http://www.w3.org/2001/XMLSchema-instance" xmlns="http://statmod.ru/courses" year="2016/2017" spec="mm" xsi:schemaLocation="http://statmod.ru/courses spec.xsd">
	<course semester="5" year="3" class="общ." extras="" hours="2" exam="зачет" year_equiv="0.5" alias="ball_teorver_pract">
		<name xml:lang="ru">Теория вероятностей</name>
		<prof id="vv_nekrutkin"/>
	</course>
	<course semester="5" year="3" class="общ." extras="" hours="2" exam="зачет" year_equiv="0.5" alias="bmm_prog_c_pract">
		<name xml:lang="ru">Спец.выч. практикум</name>
		<prof id="pv_shpilev"/>
	</course>
	<course semester="5" year="3" class="общ." extras="" hours="2" exam="зачет" year_equiv="0.5" alias="ball_tex">
		<name xml:lang="ru">Выч. практикум</name>
		<prof id="ai_korobeynikov"/>
	</course>
	<course semester="5" year="3" class="спец." extras="" hours="2" exam="экз." year_equiv="0.5" alias="bsa_graph_theory">
		<name xml:lang="ru">Структурное представление систем</name>
		<prof id="ya_sushkov"/>
	</course>
 	<course semester="5" year="3" class="спец." extras="" hours="2" exam="зачет" year_equiv="0.5" alias="bmm_prog_c_lang">
		<name xml:lang="ru">Теория и практика программирования</name>
		<prof id="pv_shpilev"/>
	</course>
	<course semester="6" year="3" class="общ." extras="" hours="2" exam="доп." year_equiv="0.5" alias="ball_teorver_pract">
		<name xml:lang="ru">Теория вероятностей</name>
		<prof id="vv_nekrutkin"/>
	</course>
	<course semester="6" year="3" class="общ." extras="" exam="доп." year_equiv="" alias="ball_teorver_kurs">
		<name xml:lang="ru">Курсовая работа по теор. вер.</name>
		<prof id="pv_shpilev"/>
	</course>
	<course semester="6" year="3" class="общ." extras="" hours="2" exam="зачет" year_equiv="0.5" alias="bmm_prog_cpp_pract">
		<name xml:lang="ru">Спец. выч. практикум</name>
		<prof id="pv_shpilev"/>
	</course>
<course semester="6" year="3" class="спец." extras="" hours="2" exam="зачет" year_equiv="0.5" alias="bsa_prog_cpp_lang">
		<name xml:lang="ru">Программирование на С++</name>
		<prof id="pv_shpilev"/>
	</course>
		<course semester="6" year="3" class="общ." extras="" hours="2" exam="зачет" year_equiv="0.5" alias="bmm_simul_pract">
		<name xml:lang="ru">Выч. практикум</name>
		<prof id="pv_shpilev"/>
	</course>
		<course semester="5" year="3" class="проф." extras="" hours="2" exam="зачет" year_equiv="0.5" alias="ball_simul_discr">
		<name xml:lang="ru">Дискретное моделирование</name>
		<prof id="vv_nekrutkin"/>
	</course>
	<course semester="6" year="3" class="проф." extras="" hours="2" exam="зкз." year_equiv="0.5" alias="ball_simul">
		<name xml:lang="ru">Моделирование распределений</name>
		<prof id="vv_nekrutkin"/>
	</course>
	
	<course semester="7" year="4" class="общ." extras="" hours="3" exam="экз." year_equiv="0.5" alias="ball_stat">
		<name xml:lang="ru">Мат. модел. и обработка данных</name>
		<part type="lect" hours="2">
			<prof id="ms_ermakov"/>
		</part>
		<part type="pract" hours="1">
			<prof id="ai_korobeynikov"/>
		</part>
	</course>
	<course semester="7" year="4" class="спец." extras="" hours="2" exam="зачет" year_equiv="0.5" alias="bsa_prog_cpp_advanced">
		<name xml:lang="ru">Программирование и дискретные системы</name>
		<prof id="yn_kashtanov"/>
	</course>
	<course semester="7" year="4" class="общ." extras="ф." hours="2" exam="зачет" year_equiv="0.5" alias="bsa_prog_threads">
		<name xml:lang="ru">Практикум по совр. прикл. программированию</name>
		<prof id="yn_kashtanov"/>
	</course>
		<course semester="7" year="4" class="проф." extras="" hours="2" exam="зачет" year_equiv="0.5" alias="ball_communication">
		<name xml:lang="ru">Современные средства и методы научной коммуникации в области статистического моделирования</name>
	<prof id="ai_korobeynikov"/>
	</course>
<course semester="7" year="4" class="спец." extras="" hours="4" exam="экз." year_equiv="1" alias="bmm_fuzzy_sets">
		<name xml:lang="ru">Теория нечетких мн-в и ее приложения</name>
		<prof id="ay_ponomareva"/>
		<co:questions xmlns:co="http://statmod.ru/courses" file="4_67_mm_fuzzy_sets.pdf">
			<co:file_name>2011/2012</co:file_name>
		</co:questions>
	</course>
	<course semester="7" year="4" class="спец." extras="" hours="2" exam="зачет" year_equiv="0.5" alias="bmm_appl_stat">
		<name xml:lang="ru">Стохастический анализ данных</name>
		<prof id="np_alekseeva"/>
	</course>
		<course semester="7" year="4" class="проф." extras="" hours="2" exam="зачет" year_equiv="0.5" alias="ball_exper_design">
		<name xml:lang="ru">Модельно-ориентированный анализ данных</name>
		<prof id="vb_melas"/>
  </course>
 <course semester="7" year="4" class="проф." extras="" hours="2" exam="экз." year_equiv="0.5" alias="ball_parallel_comp">
		<name xml:lang="ru">Метод Монте-Карло и параллельные вычисления</name>
		<prof id="sm_ermakov"/>
  </course>
	<course semester="8" year="4" class="проф." extras="" hours="4" exam="зачет" year_equiv="1" alias="bmm_idemp_algebra">
		<name xml:lang="ru">Алгебраические методы моделирования систем</name>
		<prof id="nk_krivulin"/>
	</course>
<course semester="8" year="4" class="проф." extras="" hours="2" exam="зачет" year_equiv="0.5" alias="bsa_prediploma">
		<name xml:lang="ru">Подготовка и оформление научных исследований</name>
		<prof id="ya_sushkov"/>
	</course>
	<course semester="8" year="4" class="проф." extras="" hours="4" exam="экз." year_equiv="1" alias="ball_statprogR">
		<name xml:lang="ru">Выч. методы и пакеты в стат.исследованиях</name>
		<part type="lect" hours="2">
			<prof id="ai_korobeynikov"/>
		</part>
		<part type="pract" hours="2">
			<prof id="ai_korobeynikov"/>
		</part>
	</course>
	<course semester="8" year="4" class="проф." extras="" hours="4" exam="зачет" year_equiv="1" alias="bmm_stat_pract">
		<name xml:lang="ru">Анализ данных на компьютере</name>
		<prof id="np_alekseeva"/>
		<co:questions xmlns:co="http://statmod.ru/courses" file="4_78_mm_appl_stat.pdf">
			<co:file_name>2009/2010</co:file_name>
		</co:questions>
	</course>
	<course semester="8" year="4" class="спец." extras="" hours="2" exam="зачет" year_equiv="0.5" alias="bmm_automaton_struct">
		<name xml:lang="ru">Вероятностные автоматные модели</name>
		<prof id="ay_ponomareva"/>
		<co:questions xmlns:co="http://statmod.ru/courses" file="4_8__mm_automaton_struct.pdf">
			<co:file_name>2008/2009</co:file_name>
		</co:questions>
	</course>
<course semester="8" year="4" class="спец." extras="" hours="4" exam="экз." year_equiv="1" alias="bmm_petri_nets">
		<name xml:lang="ru">Сети Петри</name>
		<prof id="ay_ponomareva"/>
		<co:questions xmlns:co="http://statmod.ru/courses" file="5_9__mm_petri_nets.pdf">
			<co:file_name>2011/2012</co:file_name>
		</co:questions>
	</course>
	
	<!--
	<course semester="9" year="5" class="с/к" extras="" hours="2" exam="экз." year_equiv="0.5" alias="all_mva">
		<name xml:lang="ru">Многомерный анализ данных</name>
		<prof id="ne_golyandina"/>
</course>
<course semester="9" year="5" class="с/к" extras="" hours="2" exam="экз." year_equiv="0.5" alias="all_adv_design">
		<name xml:lang="ru">Дополнительные главы теории оптимального планирования эксперимента</name>
		<prof id="vb_melas"/>
</course>
<course semester="9" year="5" class="с/c" extras="" hours="2" exam="зач." year_equiv="0.5" alias="mm_real_stat">
		<name xml:lang="ru">Применение статистических методов к реальным данным</name>
		<prof id="np_alekseeva"/>
</course>
	
	<course semester="10" year="5" class="с/к" extras="" hours="2" exam="экз." year_equiv="0.5" alias="mm_adv_stat">
		<name xml:lang="ru">Дополнительные главы математической статистики</name>
		<prof id="ms_ermakov"/>
	</course>
 <course semester="10" year="5" class="с/к" extras="" hours="2" exam="экз." year_equiv="0.5" alias="mm_stoch_comp">
		<name xml:lang="ru">Стохастические вычислительные методы</name>
		<prof id="sm_ermakov"/>
</course>
<course semester="10" year="5" class="с/c" extras="" hours="2" exam="зач." year_equiv="0.5" alias="mm_random_fields">
		<name xml:lang="ru">  Случайные поля и динамические методы Монте-Карло</name>
		<prof id="tm_tovstik"/>
	</course>
<course semester="10" year="5" class="с/c" extras="" hours="2" exam="зач." year_equiv="0.5" alias="mm_parallel_comp">
		<name xml:lang="ru">Параллельное программирование вероятностных задач</name>
		<prof id="yn_kashtanov"/>
</course>
-->
</courses>
